{
  "$schema": "https://raw.githubusercontent.com/roryscot/metamap/main/schemas/metamap-projection-v2.schema.json",
  "digest": "sha256:14429688443faea6b095ecfe4fea50e0b450c527f161a2f705a9047ab26570b4",
  "entries": [
    {
      "slots": [
        {
          "cardinality": "one-or-more",
          "direction": "outgoing",
          "mappings": [
            "urn:example:consumer-schema",
            "urn:example:consumer-service"
          ],
          "name": "dependencies",
          "relation": "example:depends",
          "targets": [
            {
              "id": "urn:example:schema",
              "kind": "configuration",
              "label": "schema"
            },
            {
              "id": "urn:example:service",
              "kind": "configuration",
              "label": "service"
            }
          ]
        }
      ],
      "subject": {
        "attributes": { "path": "/network/:networkId" },
        "id": "urn:example:consumer",
        "kind": "configuration",
        "label": "consumer"
      }
    }
  ],
  "generation": {
    "digest": "sha256:6af7ab27c4a76a19b1f521cc5cc1ef4e17d0eec90421bbf2e2a24896821adca5",
    "id": "urn:metamap:generation:6af7ab27c4a76a19b1f521cc5cc1ef4e17d0eec90421bbf2e2a24896821adca5"
  },
  "graph": {
    "digest": "sha256:567b24c8c2e3e246ebb49b0b9fa10254d5c39853d66c93735e4bb4f502a263de",
    "id": "urn:metamap:example:dependency-graph"
  },
  "id": "urn:metamap:projection:14429688443faea6b095ecfe4fea50e0b450c527f161a2f705a9047ab26570b4",
  "schemaVersion": "2.0.0",
  "semantic": {
    "consumer": "urn:metamap:example:network-consumer",
    "dependencies": [
      {
        "derivation": {
          "digest": "sha256:0d11d8d14b23f1cee0dad7a60ed7fab4bb9bd1856befa1c6a5baaf61650fe153",
          "id": "urn:metamap:derivation:0d11d8d14b23f1cee0dad7a60ed7fab4bb9bd1856befa1c6a5baaf61650fe153"
        },
        "mapping": "urn:example:consumer-schema",
        "premises": [
          "urn:example:consumer-service",
          "urn:example:service-schema"
        ]
      },
      { "mapping": "urn:example:consumer-service", "premises": [] },
      { "mapping": "urn:example:service-schema", "premises": [] }
    ],
    "derivations": [
      {
        "digest": "sha256:0d11d8d14b23f1cee0dad7a60ed7fab4bb9bd1856befa1c6a5baaf61650fe153",
        "id": "urn:metamap:derivation:0d11d8d14b23f1cee0dad7a60ed7fab4bb9bd1856befa1c6a5baaf61650fe153"
      }
    ],
    "risk": {
      "budget": null,
      "classifications": [],
      "inferredMappings": ["urn:example:consumer-schema"],
      "lossyMappings": [],
      "status": "not-evaluated",
      "totalCost": null,
      "uncertainty": [
        {
          "dimensions": [
            {
              "assessments": [],
              "dimension": "identity",
              "evidence": [],
              "measurementModels": [],
              "sourceRevisions": [],
              "status": "unknown"
            },
            {
              "assessments": [],
              "dimension": "context",
              "evidence": [],
              "measurementModels": [],
              "sourceRevisions": [],
              "status": "unknown"
            },
            {
              "assessments": [],
              "dimension": "provenance",
              "evidence": [],
              "measurementModels": [],
              "sourceRevisions": [],
              "status": "unknown"
            },
            {
              "assessments": [],
              "dimension": "completeness",
              "evidence": [],
              "measurementModels": [],
              "sourceRevisions": [],
              "status": "unknown"
            },
            {
              "assessments": [],
              "dimension": "causal-relevance",
              "evidence": [],
              "measurementModels": [],
              "sourceRevisions": [],
              "status": "unknown"
            },
            {
              "assessments": [],
              "dimension": "conflicting-authority",
              "evidence": [],
              "measurementModels": [],
              "sourceRevisions": [],
              "status": "unknown"
            }
          ],
          "mapping": "urn:example:consumer-schema"
        },
        {
          "dimensions": [
            {
              "assessments": [],
              "dimension": "identity",
              "evidence": [],
              "measurementModels": [],
              "sourceRevisions": [],
              "status": "unknown"
            },
            {
              "assessments": [],
              "dimension": "context",
              "evidence": [],
              "measurementModels": [],
              "sourceRevisions": [],
              "status": "unknown"
            },
            {
              "assessments": [],
              "dimension": "provenance",
              "evidence": [],
              "measurementModels": [],
              "sourceRevisions": [],
              "status": "unknown"
            },
            {
              "assessments": [],
              "dimension": "completeness",
              "evidence": [],
              "measurementModels": [],
              "sourceRevisions": [],
              "status": "unknown"
            },
            {
              "assessments": [],
              "dimension": "causal-relevance",
              "evidence": [],
              "measurementModels": [],
              "sourceRevisions": [],
              "status": "unknown"
            },
            {
              "assessments": [],
              "dimension": "conflicting-authority",
              "evidence": [],
              "measurementModels": [],
              "sourceRevisions": [],
              "status": "unknown"
            }
          ],
          "mapping": "urn:example:consumer-service"
        },
        {
          "dimensions": [
            {
              "assessments": [],
              "dimension": "identity",
              "evidence": [],
              "measurementModels": [],
              "sourceRevisions": [],
              "status": "unknown"
            },
            {
              "assessments": [],
              "dimension": "context",
              "evidence": [],
              "measurementModels": [],
              "sourceRevisions": [],
              "status": "unknown"
            },
            {
              "assessments": [],
              "dimension": "provenance",
              "evidence": [],
              "measurementModels": [],
              "sourceRevisions": [],
              "status": "unknown"
            },
            {
              "assessments": [],
              "dimension": "completeness",
              "evidence": [],
              "measurementModels": [],
              "sourceRevisions": [],
              "status": "unknown"
            },
            {
              "assessments": [],
              "dimension": "causal-relevance",
              "evidence": [],
              "measurementModels": [],
              "sourceRevisions": [],
              "status": "unknown"
            },
            {
              "assessments": [],
              "dimension": "conflicting-authority",
              "evidence": [],
              "measurementModels": [],
              "sourceRevisions": [],
              "status": "unknown"
            }
          ],
          "mapping": "urn:example:service-schema"
        }
      ]
    },
    "usedMappings": [
      "urn:example:consumer-schema",
      "urn:example:consumer-service",
      "urn:example:service-schema"
    ]
  },
  "spec": {
    "digest": "sha256:18c3c143d7cc7ce64f71306f6775fab64e34ca2e3f270dad8d4693c70f72141a",
    "id": "urn:metamap:example:dependency-projection"
  }
}
